{
  "doc_type": "fiscal_2072",
  "extractor_name": "extractor_2072",
  "critical_fields": {
    "revenus_bruts": 30371.0,
    "frais_charges_hors_interets": null,
    "interets_emprunts": 28493.0,
    "revenu_net_foncier": 17897.0
  },
  "quality": {
    "critical_missing_fields": [
      "frais_charges_hors_interets"
    ],
    "quality_flags_must_include": [
      "critical_fields_missing",
      "low_field_coverage",
      "manual_review_recommended"
    ],
    "quality_flags_must_exclude": [],
    "needs_review": true,
    "ready_for_ai": false,
    "ready_for_ai_core": false
  }
}
