{
  "doc_type": "bilan",
  "extractor_name": "extractor_bilan",
  "critical_fields": {
    "total_actif": 100000.0,
    "total_passif": 100000.0,
    "capitaux_propres": 29000.0,
    "dettes_financieres": 70000.0,
    "dettes_fournisseurs": 1000.0
  },
  "quality": {
    "critical_missing_fields": [],
    "quality_flags_must_include": [],
    "quality_flags_must_exclude": [
      "critical_fields_missing"
    ],
    "needs_review": false,
    "ready_for_ai": true
  }
}
