{
  "doc_type": "compte_resultat",
  "extractor_name": "extractor_compte_resultat",
  "critical_fields": {
    "chiffre_affaires": 30327.48,
    "resultat_exploitation": 1081.59,
    "charges_financieres": 38.86,
    "resultat_net": 1042.73
  },
  "quality": {
    "critical_missing_fields": [],
    "quality_flags_must_exclude": [
      "critical_fields_missing",
      "result_chain_inconsistent"
    ],
    "needs_review": true,
    "ready_for_ai": false,
    "ready_for_ai_core": true
  }
}
