{
  "doc_type": "bilan",
  "extractor_name": "extractor_bilan",
  "critical_fields": {
    "total_actif": 312593.89,
    "total_passif": 312593.89,
    "capitaux_propres": 1042.73,
    "dettes_financieres": 190241.85,
    "dettes_fournisseurs": 4586.59
  },
  "quality": {
    "critical_missing_fields": [],
    "quality_flags_must_exclude": [
      "critical_fields_missing",
      "bilan_balance_mismatch"
    ],
    "needs_review": false,
    "ready_for_ai_core": true
  }
}
