{
  "doc_type": "compte_resultat",
  "extractor_name": "extractor_compte_resultat",
  "critical_fields": {
    "chiffre_affaires": 1200000.0,
    "charges_externes": 500000.0,
    "resultat_exploitation": 120000.0,
    "resultat_courant": 110000.0,
    "resultat_net": 95000.0
  },
  "quality": {
    "critical_missing_fields": [],
    "quality_flags_must_include": [
      "manual_review_recommended"
    ],
    "quality_flags_must_exclude": [
      "critical_fields_missing"
    ],
    "needs_review": true,
    "ready_for_ai": false,
    "ready_for_ai_core": false
  }
}
