{
  "doc_type": "compte_resultat",
  "extractor_name": "extractor_compte_resultat",
  "critical_fields": {
    "chiffre_affaires": 50000.0,
    "charges_externes": 20000.0,
    "resultat_exploitation": 8000.0,
    "resultat_courant": 7500.0,
    "resultat_net": 7000.0
  },
  "quality": {
    "critical_missing_fields": [],
    "quality_flags_must_include": [
      "manual_review_recommended"
    ],
    "quality_flags_must_exclude": [
      "critical_fields_missing"
    ],
    "needs_review": false,
    "ready_for_ai": false,
    "ready_for_ai_core": true
  }
}
