{
  "doc_type": "fiscal_2072",
  "extractor_name": "extractor_2072",
  "critical_fields": {
    "revenus_bruts": 26813.0,
    "frais_charges_hors_interets": 6404.0,
    "interets_emprunts": 276.0,
    "revenu_net_foncier": 20133.0,
    "nombre_associes": 2
  },
  "quality": {
    "critical_missing_fields": [],
    "quality_flags_must_exclude": [
      "critical_fields_missing"
    ],
    "needs_review": false,
    "ready_for_ai_core": true
  }
}
